{
  "$schema": "./evidence-ledger.schema.json",
  "ledgerVersion": 1,
  "project": "cortexel",
  "targetRelease": "1.0.0",
  "currentRelease": "0.9.0",
  "statement": "This ledger records what was actually executed. A gate is PASS only with a linked receipt. 0.9.0 is a pre-1.0 development release and makes no 1.0 stable-contract claim.",
  "baselineCommit": "16f2da71a5beb863235a90e552e6772639638be3",
  "gates": [
    {
      "id": "R001",
      "section": "Product boundary and identity",
      "requirement": "Stable documentation defines Cortexel as a closed figure-contract catalog, not a general visualization grammar.",
      "releaseBlocking": true,
      "status": "NOT_RUN",
      "evidence": null,
      "notes": "The cited source commit predates docs/SCOPE.md and the closed-catalog README wording, and `bun run test` did not verify this documentation claim."
    },
    {
      "id": "R002",
      "section": "Product boundary and identity",
      "requirement": "The stable catalog contains only the approved v1 identifiers and `FigureBundleV1`.",
      "releaseBlocking": true,
      "status": "NOT_RUN",
      "evidence": null,
      "notes": "The receipt is factually inaccurate: manifest.stableSkills contains 19 skill ids, not `19 + figure.bundle`, and the cited test checks only the count rather than the approved identifier set or a FigureBundleV1 contract."
    },
    {
      "id": "R003",
      "section": "Product boundary and identity",
      "requirement": "No stable catalog entry has `scene: null`, wildcard payloads, host-enforced captions, or an unowned renderer.",
      "releaseBlocking": true,
      "status": "NOT_RUN",
      "evidence": null,
      "notes": "The capability registry shows renderer ownership but does not prove the wildcard-payload or caption-ownership clauses; it has no `scene` field to audit for `scene: null`."
    },
    {
      "id": "R004",
      "section": "Product boundary and identity",
      "requirement": "Every catalog entry has status, contract version, semantic-validator id/version, output types, limits, examples, and owner.",
      "releaseBlocking": true,
      "status": "NOT_RUN",
      "evidence": null,
      "notes": ""
    },
    {
      "id": "R005",
      "section": "Product boundary and identity",
      "requirement": "Experimental entries are absent from stable counts, default discovery, stable conformance badges, and root exports.",
      "releaseBlocking": true,
      "status": "NOT_RUN",
      "evidence": null,
      "notes": "The cited source commit does not contain test/importBoundary.test.ts, and the remaining receipt does not verify stable badges or every root export."
    },
    {
      "id": "R006",
      "section": "Product boundary and identity",
      "requirement": "Package, contract, catalog, semantic-validator, canonicalizer, renderer, theme, budget-profile, conformance-corpus, and build identities are emitted and documented.",
      "releaseBlocking": true,
      "status": "NOT_RUN",
      "evidence": null,
      "notes": "getBuildIdentity and identity.v1.json do not emit all identities named by this gate, notably semantic-validator, canonicalizer, theme, budget-profile, and conformance-corpus identities."
    },
    {
      "id": "R007",
      "section": "Product boundary and identity",
      "requirement": "All identities in npm, PyPI, schemas, manifests, artifacts, SVG reports, release metadata, and GitHub Release agree.",
      "releaseBlocking": true,
      "status": "NOT_RUN",
      "evidence": null,
      "notes": ""
    },
    {
      "id": "R008",
      "section": "Product boundary and identity",
      "requirement": "Compatibility and version-impact policy is applied to every accepted-meaning or canonical-byte change.",
      "releaseBlocking": true,
      "status": "NOT_RUN",
      "evidence": null,
      "notes": "Policy declarations describe intended handling but do not demonstrate that the policy was applied to every accepted-meaning or canonical-byte change."
    },
    {
      "id": "R009",
      "section": "Parser, schema, validation, and diagnostics",
      "requirement": "Raw JSON parsing rejects duplicate object names before materialization.",
      "releaseBlocking": true,
      "status": "PASS",
      "evidence": {
        "receipt": "test/parseJson.test.ts — duplicate member rejected before materialization",
        "toolchain": "node v26.3.0 / bun 1.3.14 / typescript 5.9.3",
        "sourceCommit": "1d2d8406b9ffbb4cfbca0899c1adcb09b8507378",
        "reviewedAt": "2026-07-15T00:00:00Z",
        "command": "bun run test"
      },
      "notes": ""
    },
    {
      "id": "R010",
      "section": "Parser, schema, validation, and diagnostics",
      "requirement": "Raw JSON parsing enforces byte, depth, member, array, string, number-token, and total-node limits before expensive work.",
      "releaseBlocking": true,
      "status": "NOT_RUN",
      "evidence": null,
      "notes": "The cited tests cover byte, depth, string, and number-token limits only; member-count, array-length, total-node, and pre-expensive-work behavior were not demonstrated."
    },
    {
      "id": "R011",
      "section": "Parser, schema, validation, and diagnostics",
      "requirement": "Malformed UTF input, invalid JSON numbers, dangerous keys, and trailing data fail with stable bounded diagnostics.",
      "releaseBlocking": true,
      "status": "NOT_RUN",
      "evidence": null,
      "notes": "The parser tests exercise representative failures, but the receipt does not verify the gate's diagnostic stability and boundedness requirements across these classes."
    },
    {
      "id": "R012",
      "section": "Parser, schema, validation, and diagnostics",
      "requirement": "Materialized JavaScript validation snapshots values without invoking accessors and rejects unsupported prototypes, cycles, sparse/decorated arrays, non-finite numbers, bigint, functions, symbols, and mutation hazards.",
      "releaseBlocking": true,
      "status": "PASS",
      "evidence": {
        "receipt": "test/safeSnapshot.test.ts — accessors, prototypes, cycles, sparse/decorated arrays, non-finite, bigint, functions, symbols",
        "toolchain": "node v26.3.0 / bun 1.3.14 / typescript 5.9.3",
        "sourceCommit": "1d2d8406b9ffbb4cfbca0899c1adcb09b8507378",
        "reviewedAt": "2026-07-15T00:00:00Z",
        "command": "bun run test"
      },
      "notes": ""
    },
    {
      "id": "R013",
      "section": "Parser, schema, validation, and diagnostics",
      "requirement": "Draft 2020-12 schemas are closed where stable contracts are closed and use explicit unevaluated/additional-property behavior.",
      "releaseBlocking": true,
      "status": "PASS",
      "evidence": {
        "receipt": "scripts/generate-contract.ts closure check; test/contractExamples.test.ts SCHEMA_UNKNOWN_PROPERTY cases",
        "toolchain": "node v26.3.0 / bun 1.3.14 / typescript 5.9.3",
        "sourceCommit": "1d2d8406b9ffbb4cfbca0899c1adcb09b8507378",
        "reviewedAt": "2026-07-15T00:00:00Z",
        "command": "bun run test"
      },
      "notes": ""
    },
    {
      "id": "R014",
      "section": "Parser, schema, validation, and diagnostics",
      "requirement": "Ajv strict mode produces no ignored-keyword or unknown-format warnings.",
      "releaseBlocking": true,
      "status": "NOT_RUN",
      "evidence": null,
      "notes": ""
    },
    {
      "id": "R015",
      "section": "Parser, schema, validation, and diagnostics",
      "requirement": "Generated TypeScript validators, Python models/validators, manifest descriptors, docs fragments, and schemas share the same source digest.",
      "releaseBlocking": true,
      "status": "NOT_RUN",
      "evidence": null,
      "notes": "The cited parity test compares request digests and selected validation outcomes; it does not assert one source digest across TypeScript validators, Python validators, manifest descriptors, docs fragments, and schemas."
    },
    {
      "id": "R016",
      "section": "Parser, schema, validation, and diagnostics",
      "requirement": "Named semantic validators are the only authority for cross-field scientific rules.",
      "releaseBlocking": true,
      "status": "NOT_RUN",
      "evidence": null,
      "notes": "A validator registry and semantics directory do not prove the negative claim that no cross-field scientific rule is implemented elsewhere."
    },
    {
      "id": "R017",
      "section": "Parser, schema, validation, and diagnostics",
      "requirement": "Every error code has phase, severity, bounded path, safe details, corrective action, documentation, and regression test.",
      "releaseBlocking": true,
      "status": "NOT_RUN",
      "evidence": null,
      "notes": "The registry documents metadata, but contract examples do not provide a regression test for every registered error code or every bounded-path/safe-detail behavior."
    },
    {
      "id": "R018",
      "section": "Parser, schema, validation, and diagnostics",
      "requirement": "Diagnostics never include unbounded input, secrets, raw file paths, prototype content, or huge arrays.",
      "releaseBlocking": true,
      "status": "NOT_RUN",
      "evidence": null,
      "notes": "summarizeValue is one diagnostic path; the receipt does not audit every diagnostic, repair value, adapter, CLI, and serialization path for the prohibited content."
    },
    {
      "id": "R019",
      "section": "Parser, schema, validation, and diagnostics",
      "requirement": "Positive, negative, boundary, metamorphic, and migration conformance vectors pass in TypeScript and Python.",
      "releaseBlocking": true,
      "status": "NOT_RUN",
      "evidence": null,
      "notes": "The cited source commit predates the Python reader, and the later parity suite covers positive examples plus two selected negatives, not the required negative, boundary, metamorphic, and migration corpus."
    },
    {
      "id": "R020",